{
  "version": "1.0.0",
  "as_of": "2026-10-01",
  "public_repository_url": null,
  "cases": [
    {
      "id": "CASE-OLSON",
      "name": "Frank R. Olson",
      "summary": "Documented nonconsensual government drug experimentation followed by a fatal hotel fall; a later homicide allegation remains unresolved in the materials reviewed. This case has strong evidence of an underlying abuse, but that is a separate proposition from proving an assassination.",
      "status": "Nonconsensual dosing documented; manner and responsibility for fatal fall contested.",
      "timeline": [
        {
          "date": "1953-11-19",
          "event": "CIA personnel secretly administered LSD at an Army–CIA scientific meeting attended by Olson.",
          "source_ids": [
            "H01"
          ]
        },
        {
          "date": "1953-11-23",
          "event": "Ruwet later stated that Olson asked whether he should be fired or quit, and expressed concern about his performance.",
          "source_ids": [
            "H05"
          ]
        },
        {
          "date": "1953-11-24",
          "event": "Ruwet described renewed agitation and arrangements for assistance in New York.",
          "source_ids": [
            "H05"
          ]
        },
        {
          "date": "1953-11-28",
          "event": "Olson died after a fall from a New York hotel window. Use November 28 provisionally; some official historical text gives November 27.",
          "source_ids": [
            "H03",
            "H01"
          ]
        },
        {
          "date": "1975-07-21",
          "event": "President Ford met the family, apologized for the circumstances of the death, and promised information and discussions of claims.",
          "source_ids": [
            "H02"
          ]
        },
        {
          "date": "1976-10-12",
          "event": "Ford signed Private Law 94-126 providing $750,000 total relief for the four survivors.",
          "source_ids": [
            "H03"
          ]
        },
        {
          "date": "1994",
          "event": "The sons' later complaint described exhumation and a forensic interpretation of a temple hematoma as evidence of a blow before the fall.",
          "source_ids": [
            "H04"
          ]
        },
        {
          "date": "2012-11-28",
          "event": "Sons filed negligent-supervision litigation alleging murder and concealment.",
          "source_ids": [
            "H04"
          ]
        },
        {
          "date": "2013-07-17",
          "event": "Court dismissed on threshold grounds including timeliness, settlement and sovereign immunity; it did not adjudicate a homicide.",
          "source_ids": [
            "H04"
          ]
        },
        {
          "date": "2026-06-30",
          "event": "House task force held a hearing on MKULTRA accountability and declassification.",
          "source_ids": [
            "H09"
          ]
        }
      ],
      "claims": [
        {
          "claim": "Olson was a CIA-employed biological warfare scientist.",
          "status": "Needs precision",
          "assessment": "The presidential statement identifies him as an Army-employed civilian biochemist. CIA involvement is documented; calling him simply a CIA employee blurs that distinction.",
          "source_ids": [
            "H03",
            "H01"
          ]
        },
        {
          "claim": "Dosing occurred nine days before death.",
          "status": "Substantially corroborated",
          "assessment": "November 19 to November 28 is nine calendar days. Historical source discrepancies should remain visible rather than silently harmonized.",
          "source_ids": [
            "H01",
            "H03"
          ]
        },
        {
          "claim": "Olson was driven by guilt over biological weapons work and intended to resign.",
          "status": "Partly supported; motives not established",
          "assessment": "Ruwet records a discussion of quitting and distress about perceived incompetence. This does not independently establish the fuller moral-guilt narrative.",
          "source_ids": [
            "H05"
          ]
        },
        {
          "claim": "1994 autopsy proved government murder.",
          "status": "Not established",
          "assessment": "The opinion reports the family's forensic allegation. That passage is not a judicial finding and is not a substitute for the complete autopsy file.",
          "source_ids": [
            "H04"
          ]
        },
        {
          "claim": "Apology and financial settlement occurred in 1975.",
          "status": "Chronology correction",
          "assessment": "The apology occurred in July 1975; the compensation legislation was signed in October 1976.",
          "source_ids": [
            "H02",
            "H03"
          ]
        },
        {
          "claim": "The precise fall was from the thirteenth floor.",
          "status": "Source discrepancy",
          "assessment": "The court's background says thirteen stories; Ford's statement and Senate account say a tenth-story window. Obtain original scene records before using a precise floor label.",
          "source_ids": [
            "H04",
            "H03",
            "H01"
          ]
        },
        {
          "claim": "Historical abuse demonstrates that current whistleblowers with similar experiences were targeted by the same network.",
          "status": "Unsupported inference",
          "assessment": "This history can inform questions and preservation priorities; a present-day allegation requires its own independently attributable records.",
          "source_ids": []
        }
      ],
      "gaps": [
        "Obtain certified 1953 death certificate, scene report and original autopsy; compare later amendments with original entries.",
        "Acquire complete 1994 forensic report, photographs, underlying laboratory notes and independent expert assessment.",
        "Obtain Manhattan prosecutor's reopening/closure correspondence before representing any official change of manner of death.",
        "Preserve source versions: some dates and floor descriptions conflict.",
        "Document source destruction and non-production separately; missing evidence does not identify an offender."
      ],
      "significance": "A useful precedent for investigating informed consent, supervisory authorization, adverse-event response, disclosure and record preservation. The evidentiary lesson is to prove each proposition separately: program existence, individual exposure, injury, causation, intent and responsible actor.",
      "source_ids": [
        "H01",
        "H02",
        "H03",
        "H04",
        "H05",
        "H09"
      ],
      "category": "Historical intelligence",
      "evidence_status": "disputed"
    },
    {
      "id": "CASE-COLBY",
      "name": "William E. Colby",
      "summary": "Colby's public oversight role is documented. His death record supports accidental drowning and hypothermia associated with severe atherosclerotic disease; a specific heart attack or stroke was a possible precipitating event. The reviewed materials do not establish assassination or coerced suicide.",
      "status": "Official accidental manner of death; no homicide established in reviewed record.",
      "timeline": [
        {
          "date": "1973-05-23",
          "event": "Colby directed CIA employees to report information about possible illegal agency activity for oversight review.",
          "source_ids": [
            "H08"
          ]
        },
        {
          "date": "1975-05-23",
          "event": "Colby testified before the Senate Church Committee.",
          "source_ids": [
            "H07"
          ]
        },
        {
          "date": "1996-04-27",
          "event": "Last contact date described in the medical examiner's opinion; Colby was staying at his Maryland vacation residence.",
          "source_ids": [
            "H06"
          ]
        },
        {
          "date": "1996-05-06",
          "event": "Body recovered from the Wicomico River after a search, according to the autopsy opinion.",
          "source_ids": [
            "H06"
          ]
        },
        {
          "date": "1996-05-10",
          "event": "Signed medical examiner opinion classified the death as accidental, with drowning and hypothermia associated with cardiovascular disease.",
          "source_ids": [
            "H06"
          ]
        }
      ],
      "claims": [
        {
          "claim": "A stroke or heart attack was conclusively demonstrated.",
          "status": "Overstated",
          "assessment": "The examiner described severe atherosclerosis and inferred a likely complication before immersion; the precise initiating medical event was not demonstrated.",
          "source_ids": [
            "H06"
          ]
        },
        {
          "claim": "Medical records support a violent attack.",
          "status": "Not supported by reviewed autopsy",
          "assessment": "The report found no evidence of significant traumatic injury; it records decomposition, which limits examination.",
          "source_ids": [
            "H06"
          ]
        },
        {
          "claim": "Colby's testimony and controversial disclosures prove a motive for his murder.",
          "status": "Unsupported causal inference",
          "assessment": "His testimony is verifiable, but historical conflict or opportunity alone does not prove an attack, perpetrator or causal chain.",
          "source_ids": [
            "H07",
            "H08"
          ]
        },
        {
          "claim": "The Olson and Colby stories form a proven assassination network.",
          "status": "Not established",
          "assessment": "Institutional overlap is an atlas relationship, not an operational or causal connection between deaths.",
          "source_ids": []
        }
      ],